title,subreddit,category
OLED burn-in could soon be a thing of the past thanks to innovative blue LED technique,gadgets,new
Bladder sensor sends 'pee-time' alerts to patients' smartphones,gadgets,new
"Galaxy Ring appears in Samsung's battery widget, expected to launch soon",gadgets,new
Drones and robots could replace some field workers as farming goes high-tech,gadgets,new
"World’s fastest camera shoots at 156.3 trillion frames per second | SCARF captures ultrafast events using “chirped” laser pulses, each “color” of the spectrum recording the event’s evolution in milliseconds.",gadgets,new
Sony Develops New 247-Megapixel Medium Format Sensor,gadgets,new
Pacemaker powered by light eliminates need for batteries and allows the heart to function more naturally,gadgets,new
Spending all day with MSI's disappointing new gaming laptops I've learned it's not just what's inside that counts,gadgets,new
"Gurman: iOS 18 to feature new home screen that is 'more customizable', as part of biggest iPhone update ever",gadgets,new
Why You Hear Voices in Your White Noise Machine,gadgets,new
"The new 'Daylight Tablet' with a LivePaper (RLCD) display claims to have zero glare, emit no blue light and has 60Hz refresh rate",gadgets,new
Vulnerability found in Apple's Silicon M-series chips – and it can't be patched,gadgets,new
Transparent Camera Built With See-Through Photoarray,gadgets,new
"Samsung users ask, “Why does the S-Pen smell so bad?“",gadgets,new
A designer 3D printed a working clone of the iconic Mac Plus,gadgets,new
Ebikes could soon have double the power. Can we expect more fires?,gadgets,new
This startup wants to fight growing global dengue outbreaks with drones,gadgets,new
Smartwatches shouldn’t make you choose between Apple and Android | Smartwatches — and soon smart rings — have become ways to lock people into ecosystems. It sucks.,gadgets,new
"Burnt rubber and gunfire are not the most pleasing of smells, but for action games, they might be the most common. At least, that’s true for GameScent, a new device that aims to make gaming more immersive by adding smell to the equation.",gadgets,new
Ethical hackers show how to open millions of hotel keycard locks | Any NFC-enabled Android phone could forge a master key for every room in a hotel,gadgets,new
"Canada Walks Back Ban of Flipper Zero, Targets 'Illegitimate' Use Cases",gadgets,new
DoorDash begins piloting drone deliveries in the US,gadgets,new
Google reshapes Fitbit in its image as users allege “planned obsolescence”,gadgets,new
"US DOJ to sue Apple for antitrust violations, Bloomberg News reports",gadgets,new
Shape-shifting ultrasound stickers detect post-surgical complications,gadgets,new
"New research: insulated blue light-emitting diodes could banish OLED burn-in, reducing manufacturing complexity, and reducing power consumption in future OLED TVs and monitors",gadgets,new
"Leak reveals the Pixel 8a's specs, with big upgrades on the way",gadgets,new
Smart rings’ ultra-precise movement tracking take wearable technology to the next level,gadgets,new
Logitech's Mevo Core is a Micro Four Thirds live-streaming camera,gadgets,new
"UK Scientists Develop Bra-Integrated Breast Cancer Monitoring System | The device tracks breast changes, boosting survival odds",gadgets,new
Stretchy Circuits Break Records for Flexible Electronics,gadgets,new
Google cuts the cord on another feature from its Phone app,gadgets,new
"Sony is reportedly pausing PSVR2 production to clear excess inventory due to a lack of games, allowing inventory to pile up.",gadgets,new
"Laser-Driven Pacemaker Guides Ailing Hearts With Light | PV semiconductor tech could find applications in neurostimulation, too",gadgets,new
VR Headsets Are Approaching the Eye’s Resolution Limits,gadgets,new
US government agencies demand fixable ice cream machines,gadgets,new
This High Schooler Invented an A.I.-Powered Trap That Zaps Invasive Lanternflies,gadgets,new
Leaked internal Sony documents show PS5 Pro will have 2-4 times improved ray tracing performance,gadgets,new
Wearable Sticker Reads Even the Smallest Finger Motions. The sensor can aid stroke patients and people with disabilities.,gadgets,new
Intel Core i9-14900KS Review - The Last of its Kind,gadgets,new
Intel’s new Core i9-14900KS arrives today with boosts up to 6.2GHz | This is likely to be one of the last LGA 1700 processors before Intel moves to a new socket and generation.,gadgets,new
New safety device for cyclists uses a Raspberry Pi and AI to spot dangerous drivers | It also alerts motorists who are approaching too fast,gadgets,new
How two developers are keeping Surface Duo alive — with Windows 11 and Android 14,gadgets,new
"Solid state battery design charges in minutes, lasts for thousands of cycles. Research paves the way for better lithium metal batteries.",gadgets,new
"Banana Pi launches $30 OpenWRT Wi-Fi 6 Router with WPA3 protection, optional PoE",gadgets,new
Apple Watch Pulse Oximetry Can Be Reactivated Through Software in 2028 or With Successful Appeal,gadgets,new
CSIRO claims new record for energy efficiency in lightweight printed solar cells,gadgets,new
Apple M3 MacBook Air hits 114 degrees Celsius under full load,gadgets,new
"Calibrite announces the most affordable monitor calibrator on the market, the Display 123 (priced at $119/£109)",gadgets,new
Ray-Ban's Meta sunglasses can now identify and describe landmarks,gadgets,new
"LG Display's 1 billion investment boosts OLED production, signals bright future for affordable tech | Get ready for an OLED price drop",gadgets,new
Diminutive Deep Sea Drone Dives for Wrecks and Reefs | Hydrus is designed to be more like a DJI quadcopter than a submarine,gadgets,new
Blood flow-imaging watch lets you see inside your body on-the-go,gadgets,new
Airbnb bans the use of indoor security cameras,gadgets,new
Surgeons use Apple's VR goggles in an operation for the first time in the UK as they repair a patient's spine,gadgets,new
"iOS 18 to include new 'hearing aid mode' for AirPods Pro, report says",gadgets,new
iReader Neo 2 e-reader is now available at $239.99 with a 6-inch E INK Carta 1300 black and white e-paper panel at 1072×1448 with 300 PPI,gadgets,new
Google says the AI-focused Pixel 8 can’t run its latest smartphone AI models,gadgets,new
"iPhone 16 Pro design files show larger Action button, new Capture button, more",gadgets,new
Your Roku TV will be unusable if you don't agree to the company's new terms,gadgets,new
"Steam Deck OLED shows slight burn-in at 1,500 hours, or 750 hours at max HDR brightness",gadgets,new
TSA unveils a prototype self-service airport checkpoint security screening system,gadgets,new
"AMD stops certifying monitors, TVs under 144 Hz for FreeSync | 120 Hz is good enough for consoles, but not for FreeSync.",gadgets,new
Toyota Is Making a Pokémon Motorcycle So You Can Ride Miraidon,gadgets,new
Samsung is making it harder to know what type of OLED TV you’re getting. D-OLED or classic WOLED? Samsung reportedly won't tell.,gadgets,new
Philips 3000 series Dual Basket Airfryer launching soon.,gadgets,new
"Soft robotic, wearable device improves walking for individual with Parkinson’s disease. Robotic exosuit eliminated gait freezing, a common and highly debilitating symptom.",gadgets,new
Drones Are Now the Real First Responders | Fremont's drone response program gets eyes on-site before emergency services arrive,gadgets,new
"LAPD issues warning about residential burglars using WiFi jammers to disable alarms, cameras",gadgets,new
Over 200 Apple Watches recovered from Illinois lakes by metal detectorist and diver,gadgets,new
"So long and thanks for all the pixels: Nvidia reportedly retiring the GTX brand for good | Once existing stocks of GTX 16 series cards are sold, it's game over.",gadgets,new
FDA approves the first over-the-counter continuous glucose monitor | It will be available starting this summer.,gadgets,new
Roku disables TVs and streaming devices until users consent to new terms,gadgets,new
Flipper Zero's Co-Founder Says the Hacking Tool Is All About Exposing Big Tech's Shoddy Security,gadgets,new
"Seven Years Ago, Nintendo’s Risky Gamble Paid Off Handsomely",gadgets,new
Bluetooth lure tracker zeroes in on best fishing spots,gadgets,new
"JEDEC Unveils GDDR7 As The Next-Gen Graphics Memory Standard, AMD &amp; NVIDIA Onboard",gadgets,new
Hip exoskeleton could help stroke patients put a spring in their step,gadgets,new
European crash tester says carmakers must bring back physical controls,gadgets,new
The iPhone SE is finally in line to get a modern look — but is it arriving too late to matter?,gadgets,new
Nintendo Switch emulator Yuzu will utterly fold and pay $2.4M to settle its lawsuit,gadgets,new
Apple refreshes 13- and 15-inch MacBook Airs with faster M3 chip,gadgets,new
"Certain doorbell cameras allow outsiders complete access, report says. A report found various brands of doorbell cameras sold by Amazon, Walmart, Sears and more have serious security flaws.",gadgets,new
Why Metalenses Are Set To Revolutionize Smartphones. Flat lenses that can be stamped onto silicon chips should make smartphone cameras simpler — and cheaper.,gadgets,new
New M3 MacBook Air Supports Up to Two External Displays With Lid Closed,gadgets,new
"Prophesee Metavision neuromorphic system that aims to eliminate blurring in smartphone photos is now ready for production through a sensor it co-developed with Sony, optimized for the Snapdragon 8 Gen 3 chipset",gadgets,new
One Tech Tip: Don't use rice for your device. Here's how to dry out your smartphone,gadgets,new
"Windows 11 now supports USB4 at 80Gbps, also known as USB 4 2.0",gadgets,new
"Apple changes course, will keep iPhone EU web apps how they are in iOS 17.4",gadgets,new
Nikon is creating the first mirrorless camera for use on the Moon,gadgets,new
"Machine gun-wielding robot dogs are better sharpshooters, claims study",gadgets,new
"HDMI Forum to AMD: No, you can’t make an open source HDMI 2.1 driver",gadgets,new
"HP wants you to pay up to 36 dollars/month to rent a printer that it monitors | ""Never own a printer again.""",gadgets,new
"Electric Sheep's jolly AI-powered garden bot edges, trims and blows",gadgets,new
"Cheap doorbell cameras have multiple serious security flaws, says Consumer Reports | Models still widely available on e-commerce sites after issues reported.",gadgets,new
MuteMe - physical mute button for teleconferencing,gadgets,new
Vision Pro teardown Japan-made parts make up 40% of new device,gadgets,new
Samsung has introduced a microSD card with data transfer speeds of up to 800 MB/s. It’s faster than any SATA SSD,gadgets,new
Lenovo ThinkPad X1 Carbon G12 laptop review: First major refresh in three years,gadgets,new
Lenovo’s Project Crystal is the world’s first laptop with a transparent microLED display,gadgets,new
Samsung unveils the Galaxy Ring as a way to 'simplify everyday wellness',gadgets,new
"Flop rock: inside the underground floppy disk music scene | Floppy disks are facing extinction, but musicians are still pumping out DIY music projects.",gadgets,new
Maker uses Raspberry Pi and AI to block noisy neighbor's music by hacking nearby Bluetooth speakers,gadgets,new
Nintendo Switch 2 delay could help deter scalpers | More time for Nintendo to stockpile inventory,gadgets,new
"Now there’s a 28,000mAh battery with a phone in it",gadgets,new
Italian exoskeleton gets disabled users walking and standing,gadgets,new
It’s Apparently Easy to Crack the Apple Vision Pro's Front Screen,gadgets,new
"This robot lawn mower cuts your grass for you, but can it play Doom? Yes, it can. | Game available from April 9 to September 9 through an official update",gadgets,new
India’s plan to let 1998 digital trade deal expire may worsen chip shortage,gadgets,new
"VoltSchemer attacks use wireless chargers to inject voice commands, fry phones",gadgets,new
Handful of Apple Vision Pro Units Develop Identical Crack in Cover Glass,gadgets,new
"Smart gloves could use haptic feedback to teach physical skills | Personalized feedback could record and transfer sensations for piano playing, controller robots, and more",gadgets,new
Google Pixel Fold 2 foldable phone leaked in high-res renders | Google could introduce the Pixel Fold 2 in June,gadgets,new
"Microsoft confirms which Xbox games are going to Switch, PlayStation",gadgets,new
Sony is now testing PSVR2 support for PC | PSVR2 owners might be able to use the headset on a PC later this year.,gadgets,new
"Samsung's Galaxy AI Is Coming to the Galaxy S23, Foldables and Tablets Next Month",gadgets,new
"No, smartwatches and smart rings can’t measure blood glucose yet | While several wearables companies are exploring this tech, the FDA warns it has yet to authorize this feature in any smartwatch or smart ring.",gadgets,new
Dr. Garmin will see you now. British researchers are testing a smartwatch to run basic diagnostic tests. Does it pave the way for more?,gadgets,new
Meet the Super DVD: Scientists Develop Massive 1 Petabit Optical Disk. Kiss your storage woes behind thanks to a new technique that houses data in 3D.,gadgets,new
"US scientists make ultra-thin pacemaker that's powered by light | Inspired by photovoltaic cells, the technology could also be used for neuromodulation and treating diseases like Parkinson's.",gadgets,new
Apple Likely Adopting RCS Messaging Standard to Comply With Chinese Law,gadgets,new
Walmart buying TV-brand Vizio for its ad-fueling customer data,gadgets,new
Apple: Don’t put your wet iPhone in rice,gadgets,new
"Mark Zuckerberg: Neural Interface Wristband For AR/VR Input Will Ship ""In The Next Few Years""",gadgets,new
Fujifilm announces X100VI at X Summit Tokyo event,gadgets,new
"Apple Officially Warns Users to Stop Putting Wet iPhones in Rice | The company said the popular remedy could cause ""small particles of rice to damage your iPhone.""",gadgets,new
Priceless barn find: World's first microcomputers discovered by cleaners,gadgets,new
"Wyze says camera breach let 13,000 customers briefly see into other people’s homes",gadgets,new
The UK moves another step closer to banning phones in schools | It follows countries like France and Italy in restricting phones during class.,gadgets,new
Samsung Galaxy Tab A9+ review - The 90-Hz tablet with 4 years of updates leaves little more to wish for,gadgets,new
I printed chocolate on a 3D printer and ate it,gadgets,new
HP Spectre x360 14 review - High-end convertible now with a larger 120-Hz OLED,gadgets,new
Wyze outage leaves customers without camera coverage overnight,gadgets,new
Apparently ants can eat your GPU now,gadgets,new
‘When you use a Walkman all the memories come back’: the people still in love with old tech,gadgets,new
"LED glass basketball court to make NBA debut this month, displaying stats and replays | Courts can also display other entertainment content and host potentially any hardcourt sport",gadgets,new
New thermal scope lets snipers see bullets in flight without tracers,gadgets,new
Ayaneo's NES-inspired mini PC is more than a retro tribute,gadgets,new
"Fire Ants live up to their name by invading PC and eating thermal paste, raising system temps",gadgets,new
Lenovo's transparent laptop concept is something else,gadgets,new
Apple Watch sweat measurement described in patent application,gadgets,new
NTU develops thinner-than-hair stretchable tech to mind-control robots,gadgets,new
Lenovo ThinkPad X1 Fold 16 laptop review: Unfolding the future,gadgets,new
HP Omen Transcend 16 (2024) laptop review: An RTX 4070 gaming machine with an OLED display,gadgets,new
"Apple fans are starting to return their Vision Pros | Comfort, headache, and eye strain are among the top reasons people say they’re returning their Vision Pro headsets.",gadgets,new
Modder releases Unix-like operating system for the NES | Source code now available on GitHub,gadgets,new
"Nvidia launches a chatbot that can run on your PC's GeForce RTX GPU | ""Chat with RTX"" requires an RTX 30 or RTX 40 series GPU",gadgets,new
Yamaha Joins Global Move to Battery Swaps for E-bikes. Removable cells plus a swap station mean bikes can fuel up in seconds.,gadgets,new
10 Actually Useful Things the Flipper Zero Can Do,gadgets,new
"An experimental 3D printer will melt steel to create new objects... in space | Printing metal objects aboard the ISS is a challenging, but potentially game-changing",gadgets,new
A new iPad Air is coming soon: Here are three things to expect,gadgets,new
Microsoft is bringing AI Super Resolution upscaling to Windows 11,gadgets,new
AMD Ryzen 8000 Hawk Point in testing - Zen4 refresh outperforms Meteor Lake in number crunching and GPU perfromance,gadgets,new
Unmodified NVIDIA CUDA apps can now run on AMD GPUs thanks to ZLUDA - VideoCardz.com,gadgets,new
A crowd destroyed a driverless Waymo car in San Francisco | No one was in Waymo’s driverless taxi as it was surrounded and set on fire in San Francisco’s Chinatown.,gadgets,new
Apple Vision Pro Could Take Four Generations to Reach 'Ideal Form',gadgets,new
This Small Wearable Device Reduces Parkinson’s Symptoms,gadgets,new
'A mouse for your mouth': New device allows users to scroll with their tongues,gadgets,new
MIT's new ultrasound sticker can check your internal organs for disease | A new stamp-sized ultrasound sticker developed by MIT can help monitor organ stiffness and detect diseases and tumor progression.,gadgets,new
Apple defends parts pairing as Oregon mulls right-to-repair bill,gadgets,new
"In a First, a Prosthetic Limb Can Sense Temperature Like a Living Hand",gadgets,new
Lenovo to show off new ThinkBook laptop with a transparent display,gadgets,new
Canada declares Flipper Zero public enemy No. 1 in car-theft crackdown,gadgets,new
This real-world Pokédex identifies pocket monsters using ChatGPT and AI voice cloning | YouTuber's nostalgic project is relatively accurate identifying images and action figures,gadgets,new
Surge S32 combines an electric auto-rickshaw with a detachable scooter,gadgets,new
Samsung gets FDA approval for a sleep apnea feature on Galaxy Watch,gadgets,new
"No, 3 million electric toothbrushes were not used in a DDoS attack",gadgets,new
Canadian government banning Flipper Zero to combat auto theft,gadgets,new
"Cablemod recalls its 16-pin GPU power adapters due to fire hazard — over $74,500 in property damage claims so far",gadgets,new
The Morning After: Apple has reportedly made multiple foldable iPhone prototypes,gadgets,new
"MacBooks, Chromebooks lead losers in laptop repairability analysis",gadgets,new
"US researchers engineer tiny earrings to track stress, periods, and more | A stylish wearable developed by UW researchers for continuous temperature monitoring and health tracking.",gadgets,new
Robo-dinosaur scares grasshoppers to shed light on why dinos evolved feathers,gadgets,new
CERN unleashes powerful robot-dog to inspect nuclear radiation zones,gadgets,new
The Samsung Galaxy Ring may launch alongside the Galaxy Z Fold 6.,gadgets,new
Asus ROG Zephyrus G16 2024 review - The gaming laptop now with G-Sync OLED and Intel Meteor Lake,gadgets,new
AiSee wearable tells blind users what they're holding in their hand,gadgets,new
Report reveals decline in quality of USB sticks and microSD Cards | Low-quality NAND chips are finding their way into branded devices,gadgets,new
EU right to repair: Sellers will be liable for a year after products are fixed,gadgets,new
Scalpers across Asia stripping RTX 4090 cards from pre-built PCs to smuggle into China | Retailers wanted to stop scalpers but even full systems remain desirable.,gadgets,new
The EU will force companies to give you an extra 12-month guarantee for repairs | Companies also won't be allowed to pull an Apple and bar independent repair stores from using second-hand parts.,gadgets,new
MSI Vector 16 HX laptop review: Titan performance without the Titan price,gadgets,new
Samsung responds to criticism of the Galaxy S24's AI photo-editing features | Samsung says it is working with regulators on some of its features,gadgets,new
Old Nvidia gaming GPUs enjoy huge performance uplifts from new mod — DLSS 3 to FSR 3 mod enables frame generation to deliver up to 75% better performance on previous GeForce RTX GPUs,gadgets,new
Snap Recalls Its Pixy Drone Because of Overheating Batteries,gadgets,new
Meta Quest receives spatial video and gesture support as company hopes the Apple Vision Pro can save mixed reality,gadgets,new
"Nanoparticle Skin Patch Monitors Tumor Size During Cancer Care | The nanoparticle-infused skin patch can send its data to a smartphone, making tumor monitoring even easier.",gadgets,new
"Leica Hopes Its New $9,500 Camera Can Save Photojournalism From AI In an age when digital imagery is increasingly vulnerable to online manipulation, Leica wants the M11-P to produce photos that can be trusted.",gadgets,new
Why Tim Cook Is Going All In on the Apple Vision Pro &amp; First Photo Of Him Wearing It,gadgets,new
"Your next TV likely will have AI, whether you want it or not",gadgets,new
"Nvidia GeForce RTX 4080 Super 16 GB under review: Increased performance for the same money - promises, promises ...",gadgets,new
Nothing Phone (2a) arriving later this month to rival the Google Pixel 8a and as 'clear upgrade' over Nothing Phone (1).,gadgets,new
Apple declares last MacBook Pro with an optical drive obsolete,gadgets,new
"Skylight presents Calendar Max, a 27-inch touchscreen intended to simply life at home.",gadgets,new
Fitbit denies Charge 5 update made devices unusable,gadgets,new
Xiaomi Mix Fold 4 tipped to launch worldwide with Snapdragon 8 Gen 3 processor.,gadgets,new
Lenovo Legion 5i 16 G9 review - The fast gaming laptop with Raptor Lake-HX and an AI engine,gadgets,new
Apple Adds Last MacBook Pro With CD Drive to Obsolete Products List,gadgets,new
"I run iFixit fighting for your Right to Repair, and we’re making real progress. AMA.",gadgets,new
"WaveAerospace has announced ""the world's fastest multirotor UAS,"" a ""new class of aircraft"" | A quadcopter drone with a 300+ mph jet turbine in the middle, capable of all-weather operation.",gadgets,new
MSI Titan 18 HX A14VIG laptop review: Year of the dragon,gadgets,new
Just got a Samsung Galaxy S24? Here are the 13 features to try first,gadgets,new
Raspberry Pi mini desktop PC has a 3D-printable case and plays DOS games | Classic gaming with a taste of Pi.,gadgets,new
"AMD’s new CPU hits 132fps in Fortnite without a graphics card | Also get 49fps in BG3, 119fps in CS2, and 41fps in Cyberpunk 2077 using the new AMD Ryzen 8700G, all without the need for an extra CPU cooler.",gadgets,new
Honor Magic6 Pro with 5000 nits display and 180 MP periscope telephoto camera to launch globally at MWC.,gadgets,new
Samsung Galaxy Z Fold 6 price could be cheaper than we thought — here’s why,gadgets,new
"Disposable vapes to be banned for children's health, government says",gadgets,new
"Functional 16-bit CPU built and runs in Excel, 3Hz processor includes 128KB of RAM, 16-color display, and a custom assembly language",gadgets,new
Researchers demonstrate rapid 3D printing with liquid metal,gadgets,new
Lenovo IdeaPad Pro 5i review: Meteor Lake dazzles on performance and endurance,gadgets,new
"The Pixel 8 Pro can now read body temps, if you swipe it across your face",gadgets,new
Saying goodbye to Mars helicopter Ingenuity after 72 flights,gadgets,new
Fossil is quitting smartwatches | The group is leaving the entire category behind. The Gen 6 will be the last gen of its smartwatches.,gadgets,new
"ExoM armored exoskeleton takes a load off – and stops bullets, too",gadgets,new
Analyst: Switch 2 will have a massive 8-inch LCD screen,gadgets,new
"First AI-powered handheld medical device to assist physicians in detecting all three common skin cancers: basal cell carcinoma, squamous cell carcinoma, and melanoma.",gadgets,new
Lenovo ThinkPad P16s G2 AMD review: Power plus OLED inside this workstation laptop,gadgets,new
"iPhone Apps Secretly Harvest Data When They Send You Notifications, Researchers Find",gadgets,new
Apple is bringing sideloading and alternate app stores to the iPhone,gadgets,new
"PlayStation has blocked hardware cheating device Cronus Zen, others may follow",gadgets,new
Skarper announces F1 team partnership for better e-bike kit.,gadgets,new
Pixel phones are broken again with critical storage permission bug,gadgets,new
OnePlus 12 has an IP65 water resistance rating — and that’s not good enough,gadgets,new
"X reportedly paid its Brazil fines to the wrong bank, causing further delay in reinstatement case",technology,new
Grindr Aims to Build the Dating World’s First AI ‘Wingman’,technology,new
Why WordPress founder Matt Mullenweg has gone 'nuclear' against investing giant Silver Lake,technology,new
"Toyota has announced that it will stop sponsoring LGBTQ parades and events, and will no longer promote diversity, equity and inclusion (DEI) initiatives.",technology,new
23andMe Trouble Sparks Calls for Users to Delete Their DNA Data: Here's How,technology,new
Politically conservative users tend to share misinformation at a greater volume than politically liberal users — This could explain why conservatives were suspended more frequently by platforms: Nature paper,technology,new
"Saudi wealth fund eyes raising stakes in Nintendo, other game firms",technology,new
EU to impose tariffs up to 45% on Chinese electric vehicles,technology,new
Intel says its Raptor Lake crashing chip nightmare is over,technology,new
Facebook launches a Gen Z-focused redesign,technology,new
"What Springfield, Ohio, can teach Canadians about digital mis- and disinformation",technology,new
Truth Social Users Are Losing Ridiculous Sums of Money to Scams | Read the complaints submitted to the FTC by users of Donald Trump's social media platform.,technology,new
"Ubisoft director blames gamers, says they've been exposed as 'non-decent humans'",technology,new
