title,subreddit,category
U.S. and Microsoft seize more than 100 websites alleged to have been part of Russian espionage campaign,technology,new
Texas sues TikTok for violating children's privacy,technology,new
Students Across the Country Call for a Back-to-School Ban on Facial Recognition,technology,new
WatchOS 11.1 beta retracted after reports of bricked Apple Watch devices,technology,new
An AI Deepfake Could Be This Election's November Surprise,technology,new
I spoke to a 60-year-old AI version of myself and it was…. unsettling,technology,new
Image of Donald Trump wading through flood water is AI-generated | Fact check,technology,new
The US and Microsoft disrupt a Russian hacking group targeting American officials and nonprofits,technology,new
Reddit's latest policy change could stifle future protests against the platform,technology,new
"EVgo gets $1.05B loan to build 7,500 DC fast chargers",technology,new
Google Says It Won't Follow Amazon's Lead With a Return-to-Office Mandate,technology,new
"Mozilla Thunderbird for Android is Almost Ready After 2 Years | The beta release for Thunderbird's Android app is here, with the stable version scheduled to arrive at the end of October.",technology,new
Please Don’t Make Me Download Another App | Our phones are being overrun,technology,new
YouTube Shorts Will Boost Max Video Length to 3 Minutes,technology,new
What would OpenAI for-profit plans be good for?,technology,new
NVD still backlogged with 17K+ unprocessed bugs,technology,new
Popular ad blocker uBlock Origin Lite pulled from Firefox store | PCWorld,technology,new
License Plate Readers Are Creating a US-Wide Database of More Than Just Cars,technology,new
Worried about that critical RCE Linux bug? Here's why you can relax,technology,new
"Uber and Lyft drivers use Teslas as makeshift robotaxis, raising safety concerns",technology,new
John Deere accused of ‘excluding’ right-to-repair language in its manuals | Senator Elizabeth Warren accused the company of potentially violating the Clean Air Act by omitting information about repairs in its manuals.,technology,new
"WP Engine sues WordPress co-creator Mullenweg and Automattic, alleging abuse of power",technology,new
Spotify now automatically creates an offline playlist when you lose internet,technology,new
42% of daily X users have a negative view of it - losing the block feature won't help,technology,new
"Humanity faces a 'catastrophic' future if we don’t regulate AI, 'Godfather of AI' Yoshua Bengio says",technology,new
FCC is offering $200 million to protect schools and libraries from hackers,technology,new
Famous AI Artist Says He's Losing Millions of Dollars From People Stealing His Work,technology,new
"Tesla recalls over 27,000 Cybertrucks over laggy reverse cameras",technology,new
Google flexes its edge in India in AI showdown,technology,new
OpenAI gets $4 billion revolving credit line on top of $6.6 billion in funding,technology,new
A Network of AI ‘Nudify’ Sites Are a Front for Notorious Russian Hackers,technology,new
A Single Cloud Compromise Can Feed an Army of AI Sex Bots,technology,new
SpaceX Offers One Month of Free Starlink to Hurricane Helene-Ravaged Areas,technology,new
Japan R&amp;D brings powerful diamond semiconductors closer to reality,technology,new
Steam will no longer sell games in Germany without age rating ,technology,new
How Artificial Intelligence Is Changing The Reports Police Write,technology,new
Silicon Valley gets its first drone delivery service,technology,new
The ‘WordPress’ fight is now a lawsuit,technology,new
SWIFT to trial live digital currency transactions next year | Reuters,technology,new
The Audiovisual Anti-Piracy Alliance (AAPA) Seeks to Expand EU Pirate Site Blocking to Browsers and VPNs,technology,new
Microsoft to employees: you can continue working from home unless productivity drops,technology,new
Spotify can now automatically create a playlist for airplane mode ,technology,new
An interstellar instrument takes a final bow. The Plasma Science Experiment aboard NASA’s Voyager 2 spacecraft turns off after 47 years and 15 billion miles.,technology,new
TESS Discovers Record-Breaking Triply-Eclipsing Triple Star ,technology,new
I investigated millions of tweets from the Kremlin’s ‘troll factory’ and discovered classic propaganda techniques reimagined for the social media age,technology,new
Federal judge stops implementation of California misinformation law ,technology,new
Biden exempts some semiconductor factories from environmental reviews,technology,new
Amazon will “ramp up” Prime Video ads in 2025,technology,new
"India’s Fab Plans Materialize, at Last ",technology,new
Scientists achieve ‘impossible task’ to control light while measuring trapped ion qubits,technology,new
Omdia Forecasts 5G RedCap to Reach 963.5 Million Connections by 2030,technology,new
‘Undigestible rate of change’ sees vendors start 'OCP of AI',technology,new
"‘Every job is going to change pretty radically,’ many in the next year, thanks to AI, says Indeed’s CEO",technology,new
Generative AI reshapes the future of software engineering,technology,new
French AI summit to focus on environmental impact of energy-hungry tech | Event will push for greater transparency and aims to rank AI firms in terms of ability to meet climate goals,technology,new
Robots and Drones Are Forming a Delivery Voltron,technology,new
Google's AI generated a 'podcast' from one of my articles and it's incredibly convincing and creepy just how well it can mimic humans talking,technology,new
Did Apple Just Kill Social Apps?,technology,new
China trains 100-billion-parameter AI model on home grown infrastructure,technology,new
Latest in WordPress war: Automattic says it wanted 8% cut of WP Engine revenue,technology,new
PostgreSQL 17 packs big performance and feature enhancements,technology,new
"Leaked: Whole Foods CEO tells staff he wants to turn Amazon’s RTO mandate into ‘carrot’ — All-hands meeting offered vague answers to many questions, and failed to explain how five days in office would fix problems that three days in-person couldn’t",technology,new
ChatGPT maker OpenAI raises $6.6 billion in fresh funding as it moves away from its nonprofit roots,technology,new
Four-legged robot learns to climb ladders,technology,new
"People are staging ‘fake animal rescues’ for social media views and donations — 1022 links showing fake rescue content were collected over six weeks from Facebook, Instagram, YouTube, TikTok, and X",technology,new
"New process vaporizes plastic bags and bottles, yielding gases to make new, recycled plastics",technology,new
"Bank of America customers report outage, with some seeing $0 balances",technology,new
"Nvidia just dropped a bombshell: Its new AI model is open, massive, and ready to rival GPT-4",technology,new
Amazon to increase number of advertisements on Prime Video,technology,new
College students used Meta’s smart glasses to dox people in real time | The demo highlights the dark side of AR glasses.,technology,new
An Epic Dystopia,technology,new
Samsung accused of obstructing Fortnite downloads,technology,new
FBI claims corrupt LA cops helped crypto CEO's cash grab,technology,new
"OpenAI closes funding at $157 billion valuation, as Microsoft, Nvidia, SoftBank join round",technology,new
"‘In awe’: scientists impressed by latest ChatGPT model o1 | The chatbot excels at science, beating PhDs on a hard science test. But it might ‘hallucinate’ more than its predecessors.",technology,new
"Surely AI Safety Legislation Is A No-Brainer | Radical Silicon Valley libertarianism is forcing us all to take on unnecessary risks, and the new technology is badly in need of regulation.",technology,new
"Google Fiber moving into a city forces ISPs to play catch-up, and this data proves it",technology,new
"GM Gains on Tesla With Fresh EV Lineup, Strong Q3 Sales",technology,new
"Top AI Labs Have 'Very Weak' Risk Management, Study Finds",technology,new
Desperate for good news about climate change? Consider the pace of clean energy growth,technology,new
"Closed Michigan nuclear power plant to come back online, the first reactor restart in the country",technology,new
The Collapse of Self-Worth in the Digital Age,technology,new
Toyota pours another $500M into electric air taxi startup Joby Aviation,technology,new
"LG’s 100x thinner-than-hair material cuts battery explosion risk in EVs by 50% | SRL allows electricity to flow normally unless the battery gets too hot, in which case it acts like a fuse to stop it.",technology,new
"After 27 years, Tcl/Tk 9 finally arrives with 64-bit power and Zip file magic",technology,new
Microsoft Launches Office 2024 for Mac and PC,technology,new
"Helene takes ultrapure quartz mines offline, threatens tech supply chains. Spruce Pine, NC contains largest known deposit of high-purity quartz.",technology,new
"OpenAI unveils easy voice assistant creation at 2024 developer event
",technology,new
"Microsoft ends HoloLens 2 production, with no successor in sight",technology,new
"I'm a Tech CEO at the Berlin Global Dialogue (w OpenAI, Emmanuel Macron) - Here's what you need to know about what's being said about AI/Tech behind closed doors - AMA",technology,new
"TikTok, YouTube and Snapchat’s video recommendations probed by European Commission
",technology,new
Judge declares NYC law on sharing food delivery customers' data unconstitutional,technology,new
"Apple allegedly imposed illegal workplace rules, NLRB says",technology,new
Arkansas sues YouTube over claims that the site is fueling a mental health crisis ,technology,new
Michael Lewis will be live in London discsusing the rise and fall of Sam Bankman-Fried.,technology,new
Google did not ask Samsung to create One UI's controversial Auto Blocker,technology,new
"India: Police detain 600 striking Samsung workers at protest | Thousands of employees of the South Korean company have been on strike since September 9. They are demanding better wages, 8-hour working days, and union recognition.",technology,new
Norwegian September EV Sales Edge Closer to 100% Goal for 2025,technology,new
"Snap employees were well aware of the app’s child safety issues, newly unsealed complaint says / Snap employees allegedly acknowledged issues with child predators, illicit gun sales, and addictive features, according to the New Mexico AG.",technology,new
"Women of color running for Congress in 2024 have faced a disproportionate number of attacks on X compared with other candidates, according to a new report from the nonprofit Center for Democracy and Technology (CDT) and the University of Pittsburgh.",technology,new
"IBM Unveils First Quantum Data Center in Europe, to Feature Heron-Based System",technology,new
Juno for YouTube has been removed from the App Store,technology,new
Dozens of Starlink systems deployed for Hurricane Helene by Biden administration,technology,new
Engineers develop solar-powered lithium extraction from brine,technology,new
OpenAI sees roughly $5 billion loss this year on $3.7 billion in revenue,technology,new
The Most Powerful Crypto Bro in Washington Has Very Weird Beliefs,technology,new
"AI coding assistants do not boost productivity or prevent burnout, study finds",technology,new
Meta is Probably Training AI on Images Taken by Meta Ray-Bans,technology,new
U.S. Justice Department investigating whether Australian airline Bonza broke money laundering laws — Private equity probe includes lead prosecutor in Sam Bankman-Fried case,technology,new
"US govt withholds top hurricane prediction model, sparking outrage amid deadly Helene — Taxpayer-funded data kept confidential behind insurance firm’s paywall",technology,new
Switch emulator Ryujinx shuts down development after “contact by Nintendo”,technology,new
Hurricane Helene Will Send Shockwaves Through the Semiconductor Industry,technology,new
‘Spy on Me’: TikTok Users Aren't Worried About China Getting Their Data,technology,new
NASA Turns Off Science Instrument to Save Voyager 2 Power,technology,new
Russian authorities prepare to block Discord,technology,new
Technological Advances Drive Solar Heater Market Growth,technology,new
"Chicago police bet big on pricey surveillance cameras. Two decades later, the devices do little to solve most crimes.",technology,new
A Faux 'October Surprise'—How Misinformation Could Upend The Election,technology,new
California Passes Law Protecting Consumer Brain Data — The state extended its current personal privacy law to include the neural data increasingly coveted by technology companies.,technology,new
Microsoft exec tells staff there won’t be an Amazon-style return-to-office mandate unless productivity drops,technology,new
"This AI Startup ""Copied"" an Open-Source Project and Got Half a Million Dollar Funding by Y Combinator",technology,new
"Before Mira Murati’s surprise exit from OpenAI, staff grumbled its o1 model had been released prematurely",technology,new
The Next Big Thing Is Still … Smart Glasses | A computer for your face—now with AI. What could go wrong?,technology,new
Car dealers renew their opposition to EV mandates,technology,new
"Has Social Media Fuelled a Teen-Suicide Crisis? - Mental-health struggles have risen sharply among young Americans, and parents and lawmakers alike are scrutinizing life online for answers.",technology,new
"An out-of-warranty battery almost left this paralyzed man’s exoskeleton useless | Ditching a $100K medical device for a small wiring issue doesn’t make sense to us, but its manufacturer would prefer to replace the whole thing.",technology,new
"‘Smart Glasses Will Replace Phones By 2030,’ Says Meta Chief Mark Zuckerberg",technology,new
Ubisoft Workers Urged to Strike Amid Return to Office Policy: Why CEOs Are Doubling Down,technology,new
"Jeep recalls 194,000 plug-in hybrids due to fire risks",technology,new
The unsealed New Mexico Snapchat lawsuit alleges the company ignored child safety | The complaint paints a picture of an environment easy for sexual predators to take advantage of.,technology,new
The Army Has Sent an Armed Robot Dog to the Middle East for Testing,technology,new
"CNN launches a digital paywall, charging some users to read articles for the first time",technology,new
"uBlock Origin Lite maker ends Firefox store support, slams Mozilla for hostile reviews",technology,new
Ubisoft investors push for company sale as shares hit decade-low | The Star Wars Outlaws effect,technology,new
The Norwegian Consumer Council along with organizations from 17 other European countries call for a EU ban on virtual currencies in videogames (Games should show real currency cost instead),technology,new
"With Newsom’s Veto, Big Tech Beats Democracy | California governor Gavin Newsom just killed the most significant AI safety legislation in the United States. His veto of SB 1047 is the result of a tech industry pressure campaign that puts us all in danger.",technology,new
"Growing Air Leak in Russian Segment Now Deemed Greatest ISS Risk, Report Reveals | NASA and Roscosmos have elevated the air leak to the highest level of risk, but they can't agree on when it becomes unmanageable.",technology,new
Microsoft Paint is getting Photoshop-like generative AI fill and erase features,technology,new
Microsoft gives Copilot a voice and vision in its biggest redesign yet,technology,new
"Research, conducted through a survey of 315 full-time U.S. employees across various industries, found that esponding to after-hours work emails fuels burnout and workplace tension",technology,new
Barron's: America’s Biggest Renewable Project Is Nearly Finished,technology,new
"Security expert uncovers widespread vulnerabilities in US voting and government systems | Hackers can manipulate court records and voter databases, researcher reveals",technology,new
Nintendo Is Now Going After YouTube Accounts Which Show Its Games Being Emulated,technology,new
“So aggravating”: Outdated ads start appearing on PS5 home screen,technology,new
 First Look at Google Pixel 9a with Stunning 5K Renders ,technology,new
How Google Ads Are Funding Disinformation Campaigns in India,technology,new
"AT&amp;T to sell entire stake in DirecTV, which will combine with Dish",technology,new
Silicon Valley has a plan to save humanity: Just flip on the nuclear reactors ,technology,new
"In fear of more user protests, Reddit announces controversial policy change",technology,new
Laser headband non-invasively IDs stroke risk in real time,technology,new
Farewell to the Tyan Server Brand As it is Giving Way to MiTAC Computing,technology,new
"Non-news website expose people to more political content than news websites | A study conducted across the Netherlands, the United States, and Poland found that approximately 66% of the political content people are exposed to comes from non-news websites.",technology,new
Inside Two Years of Turmoil at Big Tech's Anti-Terrorism Group,technology,new
Ransomware forces hospital to turn away ambulances - Only level-one trauma unit in 400 miles crippled,technology,new
Mozilla's massive lapse in judgement causes clash with uBlock Origin developer,technology,new
How the US Lost the Solar Power Race to China,technology,new
79 Percent of CEOs Say Remote Work Will Be Dead in 3 Years or Less,technology,new
Medical imaging breakthrough could transform cancer and arthritis diagnosis,technology,new
"PlayStation Network is down, knocking PS5 and PS4 gamers offline",technology,new
Revolutionising Rare Disease Diagnosis: How AI and Large Language Models are Changing the Game,technology,new
Powering Data Centers Is A Herculean Task,technology,new
"Google says its investments will add $3 bln to Malaysia's GDP by 2030, create 26,500 jobs",technology,new
China pressures firms to drop Nvidia AI chips in push for tech self-reliance,technology,new
Apple requests anti-steering injunction in Epic case be tossed given new precedent,technology,new
"Helene shutters Spruce Pine, NC mine that is pivotal to the world’s semiconductor supply",technology,new
Texas A&amp;M Proposes Tunnel System Built by The Boring Co.,technology,new
Crucial Texas hospital system turning ambulances away after ransomware attack,technology,new
A tiny town just got slammed by Helene. It could massively disrupt the tech industry,technology,new
"Data breach exposes tens of thousands of patients records, via Australia’s biggest medical imaging provider — Intruder accessed I-MED’s radiology portals using credentials left online for a year",technology,new
Verizon and Vertical Bridge agree to $3.3 billion tower transaction ,technology,new
GM’s Cruise gets $1.5 million penalty for keeping pedestrian crash details from safety regulator — Company omitted to mention that its self-driving taxi dragged a pedestrian along 20 feet (6.1 metres),technology,new
Big Tech’s Promise Never To Block Access To Politically Embarrassing Content Apparently Only Applies To Democrats ,technology,new
Systems used by courts and governments across the US riddled with vulnerabilities,technology,new
CEO of “health care terrorists” sues senators after contempt of Congress charges,technology,new
T-Mobile pays $31.5 million FCC settlement over 4 data breaches,technology,new
AI chipmaker Cerebras files for IPO to take on Nvidia,technology,new
Google Paid $2.7 Billion To Rehire AI Genius To Co-Lead Gemini: Report,technology,new
DirecTV agrees to buy satellite rival Dish (and its debt) for one dollar,technology,new
Reddit policy changes make sitewide protests nearly impossible,technology,new
GM's self-driving car unit fined $1.5 million US for failing to report crash details ,technology,new
"'This Is A Big Deal,' Says Jensen Huang As Nvidia CEO Tries On And Raves About Meta's New 'Orion' AR Glasses",technology,new
NASA's Solar Sail Mission Is Finally Flying After Deployment Glitch,technology,new
Verizon customers face mass-scale outage across the US,technology,new
"Apple has reportedly exited negotiations to invest in OpenAI, the company behind the popular ChatGPT AI chatbot",technology,new
Inside the $621 Million Legal Battle for the ‘Soul of the Internet’,technology,new
"Instructions for making the Sun: How the race for nuclear fusion has accelerated | Driven by the latest scientific advances and a huge wave of investment in private projects, the dream of generating energy by replicating the processes that keep the stars alight is no longer science fiction",technology,new
Lisa Su on AMD’s Strategy for Growth and the Future of AI,technology,new
Google to invest $1 billion in Thailand data center and AI push,technology,new
Epic lawsuit says Samsung “coordinated” with Google to get around trial verdict,technology,new
"Epic Games accuses Samsung, Google of scheme to block app rivals",technology,new
Russia is Banning Discord,technology,new
Reddit is making sitewide protests basically impossible,technology,new
Combating Misinformation Runs Deeper Than Swatting Away ‘Fake News’,technology,new
US sets new rule that could spur AI chip shipments to the Middle East ,technology,new
"How to design a US data privacy law | Op-ed: Why you should care about the GDPR, and how the US could develop a better version",technology,new
Is Verizon down? Thousands of users report service outage Monday morning,technology,new
Verizon outage causes thousands to lose service nationwide Monday,technology,new
Interesting Engineering: 500% more EV range: Panasonic’s 4680 battery to skyrocket electric vehicle efficiency,technology,new
PS5 New UI Update Also Brought Ads You Can’t Turn Off and Unwanted Forced News Feed to Select Titles,technology,new
Britain's Ministry of Defence develops smart glasses that projects real-time conversations onto the lens - they are being trialled by people with hearing difficulties,technology,new
Mazda’s $10 Subscription For Remote Start Sparks Backlash After Killing Open Source Option,technology,new
DOOM has been ported to quantum computers and can now run on a quantum computer with Quandoom port,technology,new
AMD improves Zen 5 CPU latency and performance with BIOS updates,technology,new
Parent phone use linked to family time disruptions and increased stress,technology,new
Solar power at night,technology,new
Modded cartridge bypasses HP printers' DRM defenses with man-in-the-middle attack,technology,new
DirecTV agrees to buy Dish for $1,technology,new
"Raspberry Pi and Sony made an AI-powered camera module | The $70 AI Camera works with all Raspberry Pi microcomputers, without requiring additional accelerators or a GPU.",technology,new
The European Organization for Nuclear Research (CERN) is to cut cooperation with 500 scientists affiliated with Russian institutions from November 30,technology,new
Amazon India workers say they're overworked and mistreated during a brutal heat wave,technology,new
How social media is fueling geopolitical tensions in the Horn of Africa ,technology,new
"The vast majority of polled Android Authority readers don’t want to pay for a wallpaper app | However, a small number of respondents are open to a one-time payment.",technology,new
A second judge in the Apple versus Epic Games lawsuit has implied that the Cupertino company has lied to the court | It comes after the original judge strongly implied that Apple had not told the truth about the reasons for its new App Store policy.,technology,new
"Ford targets EV ‘fence-sitters’ with offer of free home charger and installation | EV sales are growing, but a lot of people are still unwilling to make the switch. The Blue Oval wants to sweeten the deal.",technology,new
China calls for realtime censorship of satellite broadband,technology,new
Apple quietly deletes nearly a hundred VPNs that allowed Russians to get around censorship,technology,new
"Democrats and Republicans may agree more on hate speech than you think | The research found that while Democrats generally support more censorship than Republicans, both groups tend to agree on which types of hate speech should be restricted.",technology,new
Epic is suing Google — again — and now Samsung too ,technology,new
"Breakthrough bendable 32-bit microprocessor costs less than a buck to make | Barely any throughput loss, even when curved to the extreme",technology,new
"UK ends 142 years of coal power as last plant shuts after 57 years of service | The UK aims for a fully decarbonized power system by 2030, setting a powerful example for other nations transitioning to greener energy.",technology,new
"After ditching Chinese funding, UAE forges AI alliance with US in ‘tech hedging strategy’",technology,new
SpaceX is pausing Falcon 9 flights after issues following its Crew-9 launch.,technology,new
California governor vetoes major AI safety bill | SB 1047 would have required the state’s biggest AI companies to implement security measures designed to protect the public from harm.,technology,new
New hi-tech roadside cameras put millions of Aussies drivers 'on notice',technology,new
Fidelity has cut X’s value to $9.4 billion from $44 billion,technology,new
Dozens of Fortune 100 companies have unwittingly hired North Korean IT workers,technology,new
China unveils lunar spacesuit for crewed moon mission,technology,new
Don’t believe the hype: AGI is far from inevitable,technology,new
"Ten months after release, Tesla Cybertruck still missing key technology — FSD software needs to be adapted to work with the CT’s odd design",technology,new
Is Human Cognition on the Obsolescence Chopping Block? | Our minds have never met such a friend or foe as AI.,technology,new
"California governor vetoes controversial AI bill in a win for Big Tech - Tech executives and investors opposed the measure, which would have required companies to test the most powerful AI systems before release.",technology,new
AI begins its ominous split away from human thinking,technology,new
