title,subreddit,category
Apple Intelligence is now available in public betas,technology,new
Apple introduces California driver’s licenses and state IDs in Apple Wallet as part of California DMV’s mDL pilot program,technology,new
FTC Staff Report Finds Large Social Media and Video Streaming Companies Have Engaged in Vast Surveillance of Users with Lax Privacy Controls and Inadequate Safeguards for Kids and Teens,technology,new
Disney to Stop Using Slack Following Hack That Exposed Company Data,technology,new
DeepWell DTx receives FDA clearance for its therapeutic video game developer tools | TechCrunch,technology,new
AI model can reveal the structures of crystalline materials | MIT News | Massachusetts Institute of Technology,technology,new
"$100 billion AI infrastructure fund launched by Microsoft, BlackRock, UAE firm",technology,new
China's 3D NAND leader YMTC gradually switching to homegrown chipmaking tools | Tom's Hardware,technology,new
Low cognitive ability intensifies the link between social media use and anti-immigrant attitudes,technology,new
Tor anonymity infiltrated: Law enforcement monitors servers successfully ,technology,new
28 Years Later: Danny Boyle’s New Zombie Flick Was Shot on an iPhone 15,technology,new
Your Phone Won’t Be the Next Exploding Pager,technology,new
"Yahoo! Voices: Led by the South, clean energy sector added more than 150,000 jobs last year",technology,new
F.T.C. Study Finds ‘Vast Surveillance’ of Social Media Users,technology,new
Brazil threatens X with $900k daily fine for circumventing ban | Semafor,technology,new
"Amazon introduces Amelia, an AI assistant for third-party sellers ",technology,new
"Palworld developer has no idea why Nintendo’s suing over its Pokémon-like game | In a statement released earlier today, Pocketpair said it isnt aware of any patents it infringed in developing Palworld.",technology,new
Tech Jobs Have Dried Up—and Aren’t Coming Back Soon,technology,new
Human genome stored on 'everlasting' memory crystal,technology,new
 How Israel Built a Modern-Day Trojan Horse: Exploding Pagers,technology,new
iPhone 16 Pro 48MP camera 'absolutely fake',technology,new
UN advisory body makes seven recommendations for governing AI,technology,new
Iranian Hackers Tried to Tempt Biden’s Campaign With Stolen Trump Info | Hackers have been shopping the information around since the summer when they successfully spear phished a former senior campaign advisor.,technology,new
LinkedIn Is Quietly Training AI on Your Data—Here's How to Stop It,technology,new
"Is That AI? Or Does It Just Suck? AI is becoming synonymous with things that are unbelievable, generic, or just a little bit off",technology,new
Billionaire tech CEO says bosses shouldn't 'BS' employees about the impact AI will have on jobs,technology,new
Redwood Materials signs deal to recycle BMW’s EV batteries in the US | The automaker will use recycled materials from Redwood in its American-made EVs.,technology,new
Massive China-state IoT botnet went undetected for four years—until now,technology,new
Microsoft Executive Warns of Election Meddling in Final 48 Hours,technology,new
ISPs tell Supreme Court they don’t want to disconnect users accused of piracy,technology,new
Apple Gets EU Warning to Open iOS to Third-Party Connected Devices,technology,new
"Link 16 Coverage From Space, Laser Communications Relays Make Major Advances",technology,new
“Dead Internet theory” comes to life with new AI-powered social media app,technology,new
"Landmark AI deal sees Hollywood giant Lionsgate provide library for AI training. Runway deal will create a Lionsgate AI video generator, but not everyone is happy.",technology,new
Palworld maker vows to fight Nintendo lawsuit on behalf of fans and indie developers,technology,new
"Some businesses in China ban electric cars in underground car parks, citing risk of fires caused by spontaneous combustion",technology,new
Justice Department disrupts vast Chinese hacking operation that infected consumer devices,technology,new
Lebanon bans pagers and walkie-talkies on flights,technology,new
"20 years later, real-time Linux makes it to the kernel - really",technology,new
Google is going to show you even more ads on YouTube soon,technology,new
"In Venezuela, AI news anchors aren’t replacing journalists. They’re protecting them",technology,new
Forced and Child Labor Abuses Found in 75% of Lithium Battery Supply Chains,technology,new
"Forget tedious paper applications, Americans can now renew passports online",technology,new
"BioNTech to Host AI Day as an Edition of its Innovation Series on October 1, 2024",technology,new
Salesforce CEO Marc Benioff says he uses ChatGPT as a therapist,technology,new
Unveiling Venezuela’s Repression: Surveillance and Censorship Following July’s Presidential Election,technology,new
Pager and walkie-talkie attacks on Hezbollah were audacious and carefully planned,technology,new
Westinghouse's milestone 5MW microreactor ready for 2026 testing,technology,new
YouTube confirms your pause screen is now fair game for ads,technology,new
Japan walkie-talkie maker Icom investigating radio devices with its logo after Lebanon blasts,technology,new
U.S. and allies seize control of massive Chinese tech spying network,technology,new
Alleged images of Nintendo’s new Switch successor have appeared online ,technology,new
Pair of huge plasma jets spotted blasting out of gigantic black hole,technology,new
"What a Harris Presidency Could Mean to A.I. Policy
",technology,new
Nintendo and Pokémon are suing Palworld maker Pocketpair,technology,new
LinkedIn is training AI models on your data,technology,new
"Kenya, US sign historic pact on nuclear plans",technology,new
"Intel says its Raptor Lake crashing chip nightmare is over / The too-high voltage issue was the root cause, Intel now confirms.",gadgets,new
X-Ray Vision Is Here … And It’s More Disturbing Than You Think,gadgets,new
"Leak claims RTX 5090 has 600W TGP, RTX 5080 hits 400W — up to 21,760 cores, 32GB VRAM, 512-bit bus",gadgets,new
Insecure Deebot robot vacuums collect photos and audio to train AI,gadgets,new
"10x Cheaper than the iPhone 16, the NanoPhone is Your Ticket to Being the Most Intriguing Person in the Room",gadgets,new
This special case adds a USB-C port to AirPods with Lightning,gadgets,new
Nvidia's RTX 4080 Super rumored to be getting discontinued to make way for RTX 50 series | Nvidia's cutting production on the 40 series as the replacements are rumored to be coming.,gadgets,new
"Samsung confirms bootloop issue on older Galaxy phones, and here's how to fix it - Android Authority",gadgets,new
Apple will reportedly debut its in-house 5G modem with the iPhone SE 4,gadgets,new
Samsung is turning your Galaxy phone into a smart door key,gadgets,new
"Intel's latest flagship 128-core Xeon CPU costs $17,800 — Granite Rapids sets a new high pricing watermark",gadgets,new
$2.5M iPhone fraudsters imprisoned and ordered to pay restitution,gadgets,new
Star Wars fan 3D prints working AT-AT model you can ride like a horse | The pesky rebels don't stand a chance against this beast,gadgets,new
Witch’s Staff Build Is A Rad Glowing Costume Prop,gadgets,new
"Intel’s new Arrow Lake gaming CPUs will drop in just three weeks, says leak | If the rumours are true, then Intel Core Ultra 200-series CPUs and matching Z890 motherboards are finally launching later this month.",gadgets,new
No more speaker cables? New tech uses your home’s power lines to transmit audio,gadgets,new
The really simple solution to AMD's collapsing gaming GPU market share is lower prices from launch,gadgets,new
Nvidia's mid-range RTX 40 series GPUs gain ground in latest Steam hardware survey,gadgets,new
"'Smart Glasses Will Replace Phones By 2030,’ Says Meta Chief Mark Zuckerberg",gadgets,new
"Popular Juicebox EV home chargers to lose connectivity as owner quits US | The chargers will still function, but with no app scheduling or remote access.",gadgets,new
Former Nintendo factory in Kyoto opens as nostalgia-fuelled gaming museum,gadgets,new
"Apple to update iPhone SE with Face ID, Apple Intelligence, and OLED display | New iPad Air models are also incoming",gadgets,new
"Google showcases bizarre double-sided Japanese keyboard, which it won't sell — the keyboard uses a Möbius strip as its foundation",gadgets,new
Snapdragon X Elite pushed past 100W shows us what the CPU can offer on the desktop — almost 4X more power for 10% to 30% more performance,gadgets,new
"Apple cuts iPhone 16 orders at key supplier, Barclays claims",gadgets,new
"Paralyzed Man Unable to Walk After Maker of His Powered Exoskeleton Tells Him It's Now Obsolete | ""This is the dystopian nightmare that we've kind of entered in.""",gadgets,new
"The Army has sent at least one ""robot dog"" armed with an artificial intelligence-enabled gun turret to the Middle East for testing as a fresh counter-drone capability for U.S. service members.",gadgets,new
"Sony has a different approach to combatting 30th Anniversary PS5 Pro scalpers in Japan, imposing a strict set of purchase requirements that must be met",gadgets,new
[Digital Foundry] How PlayStation 5 Pro lays the groundwork for PS6 and beyond,gadgets,new
"Microsoft is discontinuing its HoloLens headsets | Production is ending on HoloLens 2 headsets, with no sign of a replacement.",gadgets,new
Java Ring: One Wearable To Rule All Authentications,gadgets,new
Laser headband non-invasively IDs stroke risk in real time | Researchers have developed a wearable laser-based device that monitors brain blood flow changes and volume when a patient holds their breath.,gadgets,new
PS5 Pro Still Hasn’t Sold Out in the US and UK,gadgets,new
AMD improves Zen 5 CPU latency and performance with BIOS updates | Windows and BIOS updates are improving the Ryzen 9000-series performance situation.,gadgets,new
"This custom laptop has 450W desktop GeForce RTX 4090 GPU, weighs nearly 7kg",gadgets,new
The Lancer300 Photo Backpack is a Modular Power Station Inspired by 'Death Stranding',gadgets,new
Snapdragon 8 Gen 4 price leaks and its bad news for your next phone purchase,gadgets,new
Modded cartridge bypasses HP printers' DRM defenses with man-in-the-middle attack | HP will not be pleased,gadgets,new
"Knit wit: 1st-ever cat cap that measures brain activity without sedation | In a first, veterinary scientists have successfully scanned the brains of cats in a conscious state.",gadgets,new
"Robot hand can detach from arm, crawl over to objects, and pick them up ",gadgets,new
Samsung unveils world’s first ultra-small solid-state battery for wearables | These batteries can be easily integrated into the increasingly slim and compact designs of future wearables.,gadgets,new
Vintage Apple keyboard from 1986 receives modern OLED and wireless enhancements |  The Apple Desktop Bus Keyboard for the IIGS is ready to take on 2024 models,gadgets,new
"I've tried Razer's new haptic seat cushion, and my butt will never be the same ",gadgets,new
"PS5 Pro doesn't come with a disc drive because Sony says it's ""giving players choices,"" like the choice to spend 80 dollar extra to play the physical games ""most players"" have",gadgets,new
iFixit’s iPhone 16 teardown finds a greatly improved battery removal process,gadgets,new
Ukraine using Vampire drones to airdrop robot dogs to frontlines,gadgets,new
"Why does my iPhone keep asking me to check in with my ex? | An iPhone feature has some users baffled as they are asked to share their location with work acquaintances, dead relatives and people on other continents.",gadgets,new
15 Year Old Makes 3D Printed Jellyfish Lamp (Kinetic Sculpture) Of Your Dreams,gadgets,new
"""The father of PlayStation"" says everyone at Sony thought the PS1 would fail when it was first pitched ",gadgets,new
"Apple patent describes using AirPods to detect heart disease, likely next year",gadgets,new
"Kuo: New Apple Vision Pro with M5 chip on the way, featuring Apple Intelligence support",gadgets,new
LG and Razer made an ultra-responsive Bluetooth controller for cloud gaming | The controller uses BT Ultra-Low Latency (ULL) to close the gap with wired gamepads.,gadgets,new
Nvidia’s RTX 5090 will reportedly include 32GB of VRAM and hefty power requirements,gadgets,new
Meta Teaches Its Ray-Ban Smart Glasses Some New AI Tricks,gadgets,new
"Just 5,000 people use the Rabbit R1 every day",gadgets,new
"Sony sure served up a feast for scalpers, who are already trying to flip the 999 USD PS5 Pro 30th anniversary bundle for 3,000 USD or even 5,000 USD.",gadgets,new
"AMD may launch Ryzen 7 9800X3D early to steal Arrow Lake's thunder | The chip could land as early as late October, around the same time as those new Core Ultra 200s",gadgets,new
Intel rolls out another fix for its CPU voltage issues which affect its Core 13th and 14th-gen processors.,gadgets,new
"Conflict minerals: The dark side of your smartphone | Buying a new smartphone can come at a cost far beyond your money, but there are things you can do.",gadgets,new
Sony's throwback PS5 Pro bundle sells out just as quickly as fans find out how much it actually costs,gadgets,new
Recreating 80's broadcast TV with a Raspberry Pi Keeps The Nostalgia Flowing,gadgets,new
"New ""AI-powered"" light gun brings Time Crisis to modern TVs | It comes with the classic arcade game preloaded",gadgets,new
LG TVs start showing ads on screensavers,gadgets,new
Sony Tries To Explain Why The PS5 Pro Is So Expensive And Doesn't Come With A Disc Drive,gadgets,new
I Wore Meta's Orion AR Glasses: A Wireless Taste of a Neural Interface Future,gadgets,new
Meta's $300 Quest 3S Headset Significantly Lowers VR's Buy-In Price,gadgets,new
"You may not 'knead' the DataToaster 3000, but this custom NAS is the 'toast of the town' which is made to accommodate two 3.5-inch mechanical hard drives.",gadgets,new
A Beautiful Lamp-Inspired PC Case,gadgets,new
Don’t ever hand your phone to the cops | Digital IDs make it tempting to leave your driver’s license at home — but that’s a dangerous risk,gadgets,new
Zotac Zone review: “a promising Steam Deck OLED rival”,gadgets,new
AMD Ryzen Z2 Extreme might feature 8 cores ,gadgets,new
Panasonic's Silky Fine Mist creates walk-through holograms for real-world displays | Spraying ultra-fine water droplets to project images,gadgets,new
Neurable's brainwave-tracking Master &amp; Dynamic headphones tell you when to take a break,gadgets,new
"California has now signed The Phone-Free Schools Act into law, mandating schools to limit or prohibit the use of phones by students",gadgets,new
Clear PS2 Is The Crystal Edition We Deserved,gadgets,new
Ryzen 7 7800X3D 16% Price Increased Over The Past Year Due To High Demand,gadgets,new
Nintendo has filed a new 24GHz wireless device with the FCC,gadgets,new
Tetris: The surprise therapy for PTSD flashbacks | Researchers show that playing the popular video game Tetris can significantly reduce flashbacks in people suffering from post-traumatic stress disorder (PTSD).,gadgets,new
"Valve is testing ARM64 support for popular games, sparking speculations about future hardware",gadgets,new
Researchers Store Entire Human Genome on ‘Everlasting’ 5D Memory Crystal,gadgets,new
"Apple now selling refurbished AirPods Pro 2 with USB-C, but you should avoid them",gadgets,new
Jony Ive confirms he’s working on a new device with OpenAI,gadgets,new
A Tamagotchi comeback? Toy gets first UK store as global sales double,gadgets,new
"The FCC wants to unlock all phones in the US within 60 days of activation, AT&amp;T and T-Mobile aren't so keen on the plan",gadgets,new
Former Snap Spectacles engineer says the new glasses are ‘obviously bad’,gadgets,new
Apple put on notice over support for third-party watches and headphones | The European Commission will work with Apple over the next six months to determine exactly what must be done to improve iOS interoperability.,gadgets,new
The PS5 lineup gets a nostalgia-inducing 30th anniversary makeover ,gadgets,new
"Mothbox, an automated insect monitor, Watches Bugs, So You — Or Your Grad Students — Don’t Have To",gadgets,new
Tiny nuclear-powered battery could work for decades in space or at sea,gadgets,new
"DJI launches the Action 5 Pro camera with subject tracking and improved video | It promises longer battery life, bigger touchscreens and 20 meter waterproofing without a case.",gadgets,new
Drones set to expedite blood sample delivery between London hospitals | It will be one of the first times this service is used in a dense urban environment,gadgets,new
"Glass Antenna Turns Windows Into 5G Base Stations Compact, inconspicuous antennas could increase cell coverage transparently.",gadgets,new
Apple pauses iPadOS 18 rollout for M4 iPad Pro after bricking complaints | Apple's servers have stopped signing the 18.0 update for M4 iPad Pros for now.,gadgets,new
NVIDIA GeForce RTX 4090 &amp; 4090D To Be Discontinued Next Month In Preparation For Next-Gen RTX 5090 &amp; 5090D GPUs,gadgets,new
Snap’s new Spectacles inch closer to compelling AR,gadgets,new
Dr. Hologram will see you now: Virtual specialists visit cancer patients,gadgets,new
Zildjian’s wireless headphones have a special ANC mode for drums,gadgets,new
Elgato has supersized the Stream Deck for broadcasters,gadgets,new
"Lexar's Impressive-Sounding 1,700 MB/s SD 8.0 Card Isn't Compatible With Anything",gadgets,new
Twenty percent of hard drives used for long-term music storage in the 90s have failed | Hard drives from the last 20 years are now slowly dying.,gadgets,new
Throwable tactical camera transmits 360° panoramic thermal images,gadgets,new
Sony will soon begin selling refurbished PlayStation 5 consoles – at around half the price of a PS5 Pro | 349/399 Dollars for the digital/disc versions.,gadgets,new
PS5 disc drive is selling out after PS5 Pro announcement ,gadgets,new
Neurode wants to treat and track ADHD symptoms through a wearable headband,gadgets,new
"Sony announces the PS5 Pro with a larger GPU, advanced ray tracing, and AI upscaling | Sony next PlayStation console is more powerful and ready for the latest games.",gadgets,new
"Apple will release iOS 18, macOS 15, iPadOS 18, other updates on September 16. Apple Intelligence won’t be part of the initial launch.",gadgets,new
"Hours after Apple unveiled a slightly bigger screen and battery, Huawei unveiled a tri-folding phone",gadgets,new
"Lexar unveils the world's first SD cards made of 316 stainless steel | They carry an IP68 rating, too",gadgets,new
Why can't Alexa Echo &amp; Google Nest Mini still use AI like Chatgpt/Gemini natively? Why is smart speaker tech lagging?,gadgets,new
Apple says AirPods Pro 2 can be used as 'clinical-grade' hearing aids,gadgets,new
iPhone 16 Pro and 16 Pro Max hands-on: Don’t Call it a Shutter Button,gadgets,new
Sony looks set to announce the PS5 Pro tomorrow in a strangely short livestream,gadgets,new
"Remote surgery performed on a pig 9,000 km away using a game controller | Dr Shannon Chan, located in Hong Kong, uses a game controller to control an endoscope located in Zurich, Switzerland, over 9,000 km (5,500 miles) away",gadgets,new
"Despite tech-savvy reputation, Gen Z falls behind in keyboard typing skills | Generation Z, also known as Zoomers, is shockingly bad at touch typing",gadgets,new
It cooks 700 meals a day and makes a mean chicken teriyaki. Meet your new robot chef,gadgets,new
Here's Huawei's tri-fold smartphone in the middle of (un)folding,gadgets,new
"AMD confirms Z2 Extreme chip, aims to boost PC gaming handheld battery life by over 300 percent. ",gadgets,new
Nvidia RTX 5080 and RTX 5090 are reportedly set to have their designs finalised this month and their TDPs might be lower than some thought,gadgets,new
"DJI’s Neo selfie drone is going to be everywhere | Priced for mass adoption, you still get a surprisingly capable 4K 30fps drone that can launch and land in the palm of your hand.",gadgets,new
Panasonic returns to the US with OLED and mini-LED sets featuring built-in Fire TV | Panasonic re-enters US TV market,gadgets,new
Nintendo Switch 2 Will Allegedly Feature Backward Compatibility Support,gadgets,new
MSI's latest concept is a massive PC you can chat with directly – no monitor needed,gadgets,new
"Bluetooth 6.0 arrives with new features and improved efficiency for wireless connectivity | The Bluetooth standard is becoming more ""aware"" of precise device surroundings",gadgets,new
Acer’s first handheld gaming PC is the Nitro Blaze,gadgets,new
This Acer Laptop's Touchpad Turns Into a Detachable Gamepad,gadgets,new
"Why Gen Z are buying “dumbphones” to limit screen time | Amid screen time concerns, many turn to simpler phones to reclaim their lives.",gadgets,new
Sensor-powered pen transforms Braille into English text with 84.5 percent accuracy | The device’s real-time algorithm and tactile sensors make it a promising tool for learning and using Braille.,gadgets,new
Just fix the ice maker…,gadgets,new
iPhone SE 4 to Complete Apple's Switch to OLED Across iPhone Lineup,gadgets,new
Benchmarks suggest 8-core Snapdragon X Plus laptops may be terrible at gaming | The new chipset is expected to debut at IFA 2024 in September,gadgets,new
Microsoft expands accessibility in gaming with new adaptive joystick and controllers | It has collaborated with 8BitDo and ByoWave as part of the Designed for Xbox program,gadgets,new
AnandTech is shutting down,gadgets,new
Mass production of M4 Pro and M4 Max MacBook Pros is underway for a possible October release | Shipments from display suppliers indicate 14- and 16-inch variants,gadgets,new
"Low cost ‘smart mask’ can detect disease from breath, researchers say | Hopes that device may improve diagnosis and monitoring of conditions such as lung and kidney disease",gadgets,new
Wearable treats pain and depression in as little as one 40-minute session | Targeted sound waves could improve pain symptoms and improvements in depression symptoms after just one session.,gadgets,new
Meta Reportedly Plans Ultralight Headset With Tethered Puck For 2027,gadgets,new
Engineers are building a jet-powered flying humanoid for disaster response,gadgets,new
Ryzen 9000 Threadripper leaked in shipping manifest with 96 cores and 192 threads | Flagship Zen 5 Threadripper might maintain the same core count as its predecessor,gadgets,new
"Sony’s PlayStation PC push now includes a controller customization app | You can use the new Accessories app to change your DualSense Edge’s button assignments, stick sensitivity, and more.",gadgets,new
"Samsung TVs will get 7 years of updates, starting with 2023 models | Some Rokus and Apple TVs receive longer update windows, though.",gadgets,new
"PlayStation 5 Pro could be revealed as soon as next month, possibly for 600 dollars | Multiple developers were discussing the console at Gamescom",gadgets,new
Apple may switch to 16GB of memory as default for new M4 series — test machines hint at a transition even on the base model | Apple previously insisted that 8GB on a Mac was 'analogous to 16GB on other systems.',gadgets,new
Historic IBM 7090 mainframe hits Christie's auction block | The IBM 7090 was introduced in 1959 and represented a pivotal shift in computing technology.,gadgets,new
Improved version of ‘Robocrop’ only picks ripe raspberries,gadgets,new
Autonomous robot deployed in Atlanta to detect threats amid crime concerns | An autonomous surveillance robot is now patrolling the streets to combat rising crime.,gadgets,new
"EE warns parents do not give children under 11 smartphones as it issues new guidelines
",gadgets,new
"EcoFlow’s Power Hat is a floppy, phone-charging solar panel for your noggin",gadgets,new
watchOS 11 unlocks a new level of usefulness for double tap on Apple Watch,gadgets,new
Amazon is bricking primary feature on $160 Echo device after 1 year,gadgets,new
Dual-screen laptops make more sense with this spiral notebook-like hinge,gadgets,new
"Meta just cancelled its Apple Vision Pro competitor, reportedly it was too pricey to ‘sell well’",gadgets,new
"iFixit put the landfill-bound Samsung Galaxy Ring through a CT scanner | Weirdly, Samsung used a press connector for the battery. It ""isn’t designed to last more than two years"".",gadgets,new
Peloton to ruin the secondhand market by charging a $95 ‘used equipment activation fee’,gadgets,new
EU iPhones will be able to change the default phone and messaging apps soon | Apple will let users easily set new default keyboard and password managers or even delete the App Store app.,gadgets,new
Snapchat and Meta Reportedly Plan to Reveal AR Glasses Next Month,gadgets,new
Microsoft and 8BitDo announce new accessibility joystick and controller for Xbox.,gadgets,new
The Story of the Successful Life and Abrupt Death of Flip Video Cameras,gadgets,new
Color ePaper display ditches batteries for wireless power,gadgets,new
Why Apple’s iPhone is losing its shine in China,gadgets,new
"Atari has updated the 7800 with an HDMI port and wireless controllers and announced ten new games. If you want wireless controllers or prefer the 7800 form factor, this is the retro Atari cartridge-playing console.",gadgets,new
"O2 over ice: Oxygen-powered ‘heart-in-a-box’ keeps donor organ alive for 9 hrs | Unlike standard cold storage, the heart-in-a-box provides continuous oxygenation and nutrient supply to the heart.",gadgets,new
Car companies are sneakily selling your driving data | Car companies are tracking drivers’ data and selling it to third-party data brokers — leaving their customers to suffer the consequences.,gadgets,new
"Despite Intel patch, Black Myth: Wukong devs warn about Core 13th and 14th Gen CPU crashing — studio provides a few workarounds to avoid crashing issue",gadgets,new
"""The world's first medieval electronic instrument"": Teenage Engineering announces medieval-themed version of the EP-133 K.O. II sampler",gadgets,new
